{
  "version": "agentboundary/v0.1",
  "receipt_id": "0192c8d2-5c6d-7e8f-9a0b-1c2d3e4f5a6b",
  "issued_at": "2026-06-15T16:02:17Z",
  "actor": {
    "type": "agent",
    "id": "agent:support-triage:incident/INC-44231",
    "display_name": "Support triage bot"
  },
  "agent": {
    "framework": "openai-agents-sdk",
    "framework_version": "0.18.2",
    "model": "gpt-5.5-mini"
  },
  "tool": {
    "name": "stripe-mcp",
    "version": "1.2.0",
    "capability": "stripe.refund"
  },
  "target": {
    "system": "api.stripe.com",
    "environment": "prod",
    "resource_id": "ch_3PqL8aR2eZ4nX1qB1G7Y0wXz"
  },
  "arguments_hash": "e65add6aa17488de46d19a71999c74dbcb6baeadd42c5186e9ab3ca68e7aeb12",
  "policy": {
    "name": "acme.refunds.under-500-auto-approve",
    "version": "8",
    "decision": "allow"
  },
  "execution": {
    "status": "success",
    "completed_at": "2026-06-15T16:02:18Z",
    "result_ref": "re_1OHl3gLkdIwHu7ixGGvTXKJe"
  },
  "receipt_hash": "d0e63cbd6ca6a4891789e20905b5f05fc7cf6c2ff55cb69a6e3c90cff132f2ad"
}
